
Cadence Innovus(TM) Implementation System.
Copyright 2017 Cadence Design Systems, Inc. All rights reserved worldwide.

Version:	v17.11-s080_1, built Fri Aug 4 11:13:11 PDT 2017
Options:	
Date:		Wed Nov 26 23:30:07 2025
Host:		mario.ece.utexas.edu (x86_64 w/Linux 4.18.0-553.82.1.el8_10.x86_64) (16cores*64cpus*Intel(R) Xeon(R) Gold 5218 CPU @ 2.30GHz 22528KB)
OS:		Red Hat Enterprise Linux release 8.10 (Ootpa)

License:
		invs	Innovus Implementation System	17.1	checkout succeeded
		8 CPU jobs allowed with the current license(s). Use setMultiCpuUsage to set your required CPU count.
**ERROR: (IMPOAX-142):	Could not open shared library libinnovusoax22.so : /usr/local/packages/cadence_2017/innovus171/tools.lnx86/lib/64bit/libstdc++.so.6: version `CXXABI_1.3.8' not found (required by /usr/local/packages/cadence_2022/INNOVUS211/oa_v22.60.087/lib/linux_rhel60_64/opt/liboaDesign.so)

**ERROR: (IMPOAX-142):	Could not open shared library libcdsSkillPcell.so : /usr/local/packages/cadence_2017/innovus171/tools.lnx86/lib/64bit/libcdsSkillPcell.so: undefined symbol: _ZTIN12OpenAccess_413oaFSComponentE

**ERROR: (IMPOAX-142):	OA features will be disabled in this session.

Change the soft stacksize limit to 0.2%RAM (771 mbytes). Set global soft_stack_size_limit to change the value.

**INFO:  MMMC transition support version v31-84 

<CMD> set_global _enable_mmmc_by_default_flow      $CTE::mmmc_default
<CMD> suppressMessage ENCEXT-2799
<CMD> getVersion
<CMD> getDrawView
<CMD> loadWorkspace -name Physical
<CMD> win
<CMD> set init_gnd_net 1'b0
<CMD> set init_lef_file gscl45nm.lef
<CMD> set init_design_settop 0
<CMD> set init_verilog {apr45nm.v synth_netlist.v}
<CMD> set init_pwr_net 1'b1
<CMD> init_design
**ERROR: (IMPOAX-820):	The OA features are disabled in the current session of Innovus because the oax shared library could not be loaded properly. This could be because your installation was not properly configured. To enable OA features, exit the current session and re-launch Innovus either after fixing your installation by running the Configure Installation phase, or after setting the OA_HOME variable to point to a proper OA installation. Check the "OpenAccess Installation and Configuration Guide" manual for more information.

**ERROR: (IMPOAX-850):	oaxCreateCdsLibArray command cannot be run as OA features are disabled in this session.

Loading LEF file gscl45nm.lef ...
**WARN: (IMPLF-155):	ViaRule only supports routing/cut layer, but poly layer found for viaRule 'M1_POLY', 
Set DBUPerIGU to M2 pitch 380.

viaInitial starts at Wed Nov 26 23:31:56 2025
viaInitial ends at Wed Nov 26 23:31:56 2025
*** End library_loading (cpu=0.00min, real=0.00min, mem=0.0M, fe_cpu=0.19min, fe_real=1.82min, fe_mem=517.1M) ***
#% Begin Load netlist data ... (date=11/26 23:31:56, mem=516.0M)
*** Begin netlist parsing (mem=517.1M) ***
Created 0 new cells from 0 timing libraries.
Reading netlist ...
Backslashed names will retain backslash and a trailing blank character.
Reading verilog netlist 'apr45nm.v'
Reading verilog netlist 'synth_netlist.v'

*** Memory Usage v#1 (Current mem = 519.055M, initial mem = 194.469M) ***
*** End netlist parsing (cpu=0:00:00.0, real=0:00:00.0, mem=519.1M) ***
#% End Load netlist data ... (date=11/26 23:31:57, total cpu=0:00:00.0, real=0:00:01.0, peak res=519.9M, current mem=519.9M)
Top level cell is core.
Hooked 0 DB cells to tlib cells.
Starting recursive module instantiation check.
No recursion found.
Building hierarchical netlist for Cell core ...
*** Netlist is unique.
Set DBUPerIGU to techSite CoreSite width 760.
** info: there are 34 modules.
** info: there are 1795 stdCell insts.

*** Memory Usage v#1 (Current mem = 545.719M, initial mem = 194.469M) ***
Horizontal Layer M1 offset = 190 (guessed)
Vertical Layer M2 offset = 190 (guessed)
Suggestion: specify LAYER OFFSET in LEF file
Reason: hard to extract LAYER OFFSET from standard cells
Generated pitch 1.68 in metal10 is different from 1.71 defined in technology file in preferred direction.
Generated pitch 0.84 in metal8 is different from 0.855 defined in technology file in preferred direction.
Generated pitch 0.95 in metal7 is different from 0.855 defined in technology file in preferred direction.
Generated pitch 0.28 in metal6 is different from 0.285 defined in technology file in preferred direction.
Generated pitch 0.28 in metal4 is different from 0.285 defined in technology file in preferred direction.
Set Default Net Delay as 1000 ps.
Set Default Net Load as 0.5 pF. 
Set Default Input Pin Transition as 0.1 ps.
**WARN: (IMPSYT-7328):	The design has been initialized in physical-only mode because the init_mmmc_file global variable was not defined. Timing analysis will not be possible within this session. You can only use commands that do not depend on timing data. If you need to use timing, you need to restart with an init_mmmc_file to define the timing setup, or you can save this design and use restoreDesign -mmmc_file <viewDef.tcl> to add the timing setup information.
Extraction setup Started 

*** Summary of all messages that are not suppressed in this session:
Severity  ID               Count  Summary                                  
WARNING   IMPLF-155            1  ViaRule only supports routing/cut layer,...
WARNING   IMPSYT-7328          1  The design has been initialized in physi...
ERROR     IMPOAX-820           1  The OA features are disabled in the curr...
ERROR     IMPOAX-850           1  %s command cannot be run as OA features ...
*** Message Summary: 2 warning(s), 2 error(s)

<CMD> getIoFlowFlag
<CMD> setFPlanRowSpacingAndType 4.0 1
Row spacing should be a multiple of the first horizontal routing layer pitch.
Adjusting row spacing to 4.18.
<CMD> setIoFlowFlag 0
<CMD> floorPlan -flip n -site CoreSite -r 1 0.5 7.0 7 7 7
Horizontal Layer M1 offset = 190 (guessed)
Vertical Layer M2 offset = 190 (guessed)
Suggestion: specify LAYER OFFSET in LEF file
Reason: hard to extract LAYER OFFSET from standard cells
Generated pitch 1.68 in metal10 is different from 1.71 defined in technology file in preferred direction.
Generated pitch 0.84 in metal8 is different from 0.855 defined in technology file in preferred direction.
Generated pitch 0.95 in metal7 is different from 0.855 defined in technology file in preferred direction.
Generated pitch 0.28 in metal6 is different from 0.285 defined in technology file in preferred direction.
Generated pitch 0.28 in metal4 is different from 0.285 defined in technology file in preferred direction.
**WARN: (IMPFP-325):	Floorplan of the design is resized. All current floorplan objects are automatically derived based on specified new floorplan. This may change blocks, fixed standard cells, existing routes and blockages.
<CMD> uiSetTool select
<CMD> getIoFlowFlag
<CMD> fit
<CMD> set sprCreateIeRingOffset 1.0
<CMD> set sprCreateIeRingThreshold 1.0
<CMD> set sprCreateIeRingJogDistance 1.0
<CMD> set sprCreateIeRingLayers {}
<CMD> set sprCreateIeRingOffset 1.0
<CMD> set sprCreateIeRingThreshold 1.0
<CMD> set sprCreateIeRingJogDistance 1.0
<CMD> set sprCreateIeRingLayers {}
<CMD> set sprCreateIeStripeWidth 10.0
<CMD> set sprCreateIeStripeThreshold 1.0
<CMD> set sprCreateIeStripeWidth 10.0
<CMD> set sprCreateIeStripeThreshold 1.0
<CMD> set sprCreateIeRingOffset 1.0
<CMD> set sprCreateIeRingThreshold 1.0
<CMD> set sprCreateIeRingJogDistance 1.0
<CMD> set sprCreateIeRingLayers {}
<CMD> set sprCreateIeStripeWidth 10.0
<CMD> set sprCreateIeStripeThreshold 1.0
<CMD> setAddRingMode -ring_target default -extend_over_row 0 -ignore_rows 0 -avoid_short 0 -skip_crossing_trunks none -stacked_via_top_layer metal10 -stacked_via_bottom_layer metal1 -via_using_exact_crossover_size 1 -orthogonal_only true -skip_via_on_pin {  standardcell } -skip_via_on_wire_shape {  noshape }
The ring targets are set to core/block ring wires.
addRing command will consider rows while creating rings.
addRing command will disallow rings to go over rows.
addRing command will ignore shorts while creating rings.
<CMD> addRing -nets {1'b0 1'b1} -type core_rings -follow core -layer {top metal1 bottom metal1 left metal2 right metal2} -width {top 0.5 bottom 0.5 left 0.5 right 0.5} -spacing {top 0.3 bottom 0.3 left 0.3 right 0.3} -offset {top 1.8 bottom 1.8 left 1.8 right 1.8} -center 1 -extend_corner {} -threshold 0 -jog_distance 0 -snap_wire_center_to_grid None

Ring generation is complete.
vias are now being generated.
addRing created 8 wires.
ViaGen created 8 vias, deleted 0 via to avoid violation.
+--------+----------------+----------------+
|  Layer |     Created    |     Deleted    |
+--------+----------------+----------------+
| metal1 |        4       |       NA       |
|  via1  |        8       |        0       |
| metal2 |        4       |       NA       |
+--------+----------------+----------------+
**WARN: (IMPTCM-77):	Option "-drouteStartIteration" for command getNanoRouteMode is obsolete and will be removed in a future release. The obsolete option still works in this release but to avoid this warning and to ensure compatibility with future releases, remove the obsolete option from your script.
**WARN: (IMPTCM-77):	Option "-modulePlan" for command getPlaceMode is obsolete and will be removed in a future release. The obsolete option still works in this release but to avoid this warning and to ensure compatibility with future releases, remove the obsolete option from your script.
**WARN: (IMPTCM-125):	Option "-checkPinLayerForAccess" for command getPlaceMode is obsolete and will be ignored. It no longer has any effect and should be removed from your script.
<CMD> setRouteMode -earlyGlobalHonorMsvRouteConstraint false -earlyGlobalRoutePartitionPinGuide true
<CMD> setEndCapMode -reset
<CMD> setEndCapMode -boundary_tap false
<CMD> setNanoRouteMode -quiet -droutePostRouteSpreadWire 1
**WARN: (IMPTCM-77):	Option "-drouteStartIteration" for command getNanoRouteMode is obsolete and will be removed in a future release. The obsolete option still works in this release but to avoid this warning and to ensure compatibility with future releases, remove the obsolete option from your script.
**WARN: (IMPTCM-77):	Option "-drouteStartIteration" for command getNanoRouteMode is obsolete and will be removed in a future release. The obsolete option still works in this release but to avoid this warning and to ensure compatibility with future releases, remove the obsolete option from your script.
**WARN: (IMPTCM-77):	Option "-envDontUseLicsForThreadings" for command getNanoRouteMode is obsolete and will be removed in a future release. The obsolete option still works in this release but to avoid this warning and to ensure compatibility with future releases, remove the obsolete option from your script.
**WARN: (IMPTCM-77):	Option "-routeAllowPowerGroundPin" for command getNanoRouteMode is obsolete and will be removed in a future release. The obsolete option still works in this release but to avoid this warning and to ensure compatibility with future releases, remove the obsolete option from your script.
**WARN: (IMPTCM-77):	Option "-routeAllowPowerGroundPin" for command getNanoRouteMode is obsolete and will be removed in a future release. The obsolete option still works in this release but to avoid this warning and to ensure compatibility with future releases, remove the obsolete option from your script.
**WARN: (IMPTCM-77):	Option "-routeEcoOnlyInLayers" for command getNanoRouteMode is obsolete and will be removed in a future release. The obsolete option still works in this release but to avoid this warning and to ensure compatibility with future releases, remove the obsolete option from your script.
<CMD> setUsefulSkewMode -maxSkew false -noBoundary false -useCells {} -maxAllowedDelay 1
**WARN: (IMPOPT-6036):	-useCells list is empty.
<CMD> setPlaceMode -reset
<CMD> setPlaceMode -congEffort low -timingDriven 0 -modulePlan 1 -clkGateAware 0 -powerDriven 0 -ignoreScan 1 -reorderScan 1 -ignoreSpare 1 -placeIOPins 1 -moduleAwareSpare 0 -checkPinLayerForAccess {  1 } -preserveRouting 0 -rmAffectedRouting 0 -checkRoute 0 -swapEEQ 0
**WARN: (IMPTCM-77):	Option "-modulePlan" for command setPlaceMode is obsolete and will be removed in a future release. The obsolete option still works in this release but to avoid this warning and to ensure compatibility with future releases, remove the obsolete option from your script.
**WARN: (IMPTCM-125):	Option "-checkPinLayerForAccess" for command setPlaceMode is obsolete and will be ignored. It no longer has any effect and should be removed from your script.
<CMD> setPlaceMode -fp false
<CMD> placeDesign
*** Starting placeDesign default flow ***
Deleted 0 physical inst  (cell - / prefix -).
Extracting standard cell pins and blockage ...... 
Pin and blockage extraction finished
Extracting macro/IO cell pins and blockage ...... 
Pin and blockage extraction finished
*** Starting "NanoPlace(TM) placement v#10 (mem=867.0M)" ...
No user setting net weight.
Options: ignoreScan ignoreSpare pinGuide congEffort=low gpeffort=fast 
**WARN: (IMPSP-9042):	Scan chains were not defined, -place_global_ignore_scan option will be ignored.
Define the scan chains before using this option.
Type 'man IMPSP-9042' for more detail.
#std cell=1795 (0 fixed + 1795 movable) #block=0 (0 floating + 0 preplaced)
#ioInst=0 #net=1923 #term=6391 #term/net=3.32, #fixedIo=0, #floatIo=0, #fixedPin=0, #floatPin=276
stdCell: 1795 single + 0 double + 0 multi
Total standard cell length = 2.0579 (mm), area = 0.0051 (mm^2)
**Info: (IMPSP-307): Design contains fractional 20 cells.
Estimated cell power/ground rail width = 0.308 um
Average module density = 0.488.
Density for the design = 0.488.
       = stdcell_area 5416 sites (5083 um^2) / alloc_area 11100 sites (10418 um^2).
Pin Density = 0.5758.
            = total # of pins 6391 / total area 11100.
=== lastAutoLevel = 7 
**WARN: (IMPSP-9531):	Turning off clkGateAware when timingDriven is off
Iteration  1: Total net bbox = 8.460e-11 (4.00e-11 4.46e-11)
              Est.  stn bbox = 8.971e-11 (4.25e-11 4.72e-11)
              cpu = 0:00:00.0 real = 0:00:00.0 mem = 878.0M
Iteration  2: Total net bbox = 8.460e-11 (4.00e-11 4.46e-11)
              Est.  stn bbox = 8.971e-11 (4.25e-11 4.72e-11)
              cpu = 0:00:00.0 real = 0:00:00.0 mem = 878.0M
Iteration  3: Total net bbox = 1.135e+01 (7.07e+00 4.28e+00)
              Est.  stn bbox = 1.343e+01 (8.42e+00 5.01e+00)
              cpu = 0:00:00.0 real = 0:00:00.0 mem = 894.0M
Iteration  4: Total net bbox = 2.693e+04 (1.33e+04 1.36e+04)
              Est.  stn bbox = 3.412e+04 (1.70e+04 1.71e+04)
              cpu = 0:00:00.3 real = 0:00:00.0 mem = 894.0M
Iteration  5: Total net bbox = 3.022e+04 (1.51e+04 1.51e+04)
              Est.  stn bbox = 3.920e+04 (1.97e+04 1.95e+04)
              cpu = 0:00:00.5 real = 0:00:01.0 mem = 894.0M
Iteration  6: Total net bbox = 3.035e+04 (1.51e+04 1.53e+04)
              Est.  stn bbox = 3.916e+04 (1.96e+04 1.95e+04)
              cpu = 0:00:00.3 real = 0:00:00.0 mem = 895.0M
Iteration  7: Total net bbox = 3.754e+04 (1.86e+04 1.89e+04)
              Est.  stn bbox = 4.738e+04 (2.35e+04 2.39e+04)
              cpu = 0:00:00.0 real = 0:00:00.0 mem = 895.0M
Iteration  8: Total net bbox = 3.754e+04 (1.86e+04 1.89e+04)
              Est.  stn bbox = 4.738e+04 (2.35e+04 2.39e+04)
              cpu = 0:00:00.0 real = 0:00:00.0 mem = 895.0M
Iteration  9: Total net bbox = 3.839e+04 (1.97e+04 1.87e+04)
              Est.  stn bbox = 4.842e+04 (2.47e+04 2.37e+04)
              cpu = 0:00:00.2 real = 0:00:00.0 mem = 895.0M
Iteration 10: Total net bbox = 3.865e+04 (1.97e+04 1.89e+04)
              Est.  stn bbox = 4.872e+04 (2.48e+04 2.39e+04)
              cpu = 0:00:00.8 real = 0:00:01.0 mem = 895.0M
Iteration 11: Total net bbox = 3.865e+04 (1.97e+04 1.89e+04)
              Est.  stn bbox = 4.872e+04 (2.48e+04 2.39e+04)
              cpu = 0:00:00.0 real = 0:00:00.0 mem = 895.0M
*** cost = 3.865e+04 (1.97e+04 1.89e+04) (cpu for global=0:00:01.9) real=0:00:03.0***
Solver runtime cpu: 0:00:01.9 real: 0:00:01.9
Core Placement runtime cpu: 0:00:01.9 real: 0:00:03.0
**WARN: (IMPSP-9025):	No scan chain specified/traced.
Type 'man IMPSP-9025' for more detail.
**Info: (IMPSP-307): Design contains fractional 20 cells.
*** Starting refinePlace (0:00:20.4 mem=895.0M) ***
Total net bbox length = 3.873e+04 (1.969e+04 1.904e+04) (ext = 5.262e+03)
Density distribution unevenness ratio = 6.564%
Move report: Detail placement moves 1795 insts, mean move: 1.19 um, max move: 31.78 um
	Max move on inst (_2170_): (36.99, 60.33) --> (11.97, 53.58)
	Runtime: CPU: 0:00:00.2 REAL: 0:00:00.0 MEM: 896.0MB
Summary Report:
Instances move: 1795 (out of 1795 movable)
Instances flipped: 0
Mean displacement: 1.19 um
Max displacement: 31.78 um (Instance: _2170_) (36.995, 60.331) -> (11.97, 53.58)
	Length: 2 sites, height: 1 rows, site name: CoreSite, cell type: NAND2X1
Total net bbox length = 3.846e+04 (1.950e+04 1.896e+04) (ext = 5.280e+03)
Runtime: CPU: 0:00:00.2 REAL: 0:00:00.0 MEM: 896.0MB
*** Finished refinePlace (0:00:20.6 mem=896.0M) ***
*** End of Placement (cpu=0:00:02.2, real=0:00:03.0, mem=896.0M) ***
**Info: (IMPSP-307): Design contains fractional 20 cells.
default core: bins with density >  0.75 =    0 % ( 0 / 21 )
Density distribution unevenness ratio = 6.597%
Starting IO pin assignment...
The design is not routed. Using flight-line based method for pin assignment.
Completed IO pin assignment.
*** Finishing placeDesign default flow ***
**placeDesign ... cpu = 0: 0: 2, real = 0: 0: 3, mem = 900.0M **

*** Summary of all messages that are not suppressed in this session:
Severity  ID               Count  Summary                                  
WARNING   IMPSP-9531           1  Turning off clkGateAware when timingDriv...
WARNING   IMPSP-9025           1  No scan chain specified/traced.          
WARNING   IMPSP-9042           1  Scan chains were not defined, -place_glo...
*** Message Summary: 3 warning(s), 0 error(s)

<CMD> selectInst _2860_
<CMD> deselectAll
<CMD> fit
**WARN: (IMPTCM-77):	Option "-drouteStartIteration" for command getNanoRouteMode is obsolete and will be removed in a future release. The obsolete option still works in this release but to avoid this warning and to ensure compatibility with future releases, remove the obsolete option from your script.
<CMD> setNanoRouteMode -quiet -timingEngine {}
<CMD> setNanoRouteMode -quiet -routeWithSiPostRouteFix 0
**WARN: (IMPTCM-77):	Option "-drouteStartIteration" for command getNanoRouteMode is obsolete and will be removed in a future release. The obsolete option still works in this release but to avoid this warning and to ensure compatibility with future releases, remove the obsolete option from your script.
<CMD> setNanoRouteMode -quiet -drouteStartIteration default
**WARN: (IMPTCM-77):	Option "-drouteStartIteration" for command setNanoRouteMode is obsolete and will be removed in a future release. The obsolete option still works in this release but to avoid this warning and to ensure compatibility with future releases, remove the obsolete option from your script.
<CMD> setNanoRouteMode -quiet -routeTopRoutingLayer default
<CMD> setNanoRouteMode -quiet -routeBottomRoutingLayer default
<CMD> setNanoRouteMode -quiet -drouteEndIteration default
**WARN: (IMPTCM-77):	Option "-routeEcoOnlyInLayers" for command getNanoRouteMode is obsolete and will be removed in a future release. The obsolete option still works in this release but to avoid this warning and to ensure compatibility with future releases, remove the obsolete option from your script.
<CMD> setNanoRouteMode -quiet -routeWithTimingDriven false
<CMD> setNanoRouteMode -quiet -routeWithSiDriven false
Running Native NanoRoute ...
<CMD> routeDesign -globalDetail
#routeDesign: cpu time = 00:00:00, elapsed time = 00:00:00, memory = 800.22 (MB), peak = 800.22 (MB)
#WARNING (NRIG-96) Selected single pass global detail route "-globalDetail". Clock eco and post optimizations will not be run. See "man NRIG-96" for more details.
#**INFO: setDesignMode -flowEffort standard
#**INFO: mulit-cut via swapping is disabled by user.
#**INFO: All auto set options tuned by routeDesign will be restored to their original settings on command completion.
#**INFO: auto set of routeReserveSpaceForMultiCut to true
#**INFO: auto set of routeConcurrentMinimizeViaCountEffort to high
**Info: (IMPSP-307): Design contains fractional 20 cells.
Begin checking placement ... (start mem=901.4M, init mem=901.4M)
*info: Placed = 1795          
*info: Unplaced = 0           
Placement Density:48.79%(5083/10418)
Placement Density (including fixed std cells):48.79%(5083/10418)
Finished checkPlace (cpu: total=0:00:00.0, vio checks=0:00:00.0; mem=901.4M)
#**INFO: honoring user setting for routeWithTimingDriven set to false
#**INFO: honoring user setting for routeWithSiDriven set to false
**WARN: (IMPCK-8086):	The command changeUseClockNetStatus is obsolete and will be removed in the next release. This command still works in this release, but by the next release you must transition to the CCOpt-based CTS flow.

changeUseClockNetStatus Option :  -noFixedNetWires 
*** Changed status on (0) nets in Clock.
*** End changeUseClockNetStatus (cpu=0:00:00.0, real=0:00:00.0, mem=901.4M) ***

globalDetailRoute

#setNanoRouteMode -droutePostRouteSpreadWire "1"
#setNanoRouteMode -routeConcurrentMinimizeViaCountEffort "high"
#setNanoRouteMode -routeReserveSpaceForMultiCut true
#setNanoRouteMode -routeWithSiDriven false
#setNanoRouteMode -routeWithTimingDriven false
#Start globalDetailRoute on Wed Nov 26 23:36:05 2025
#
#WARNING (NRDB-2005) SPECIAL_NET 1'b1 has special wires but no definitions for instance pins or top level pins. This will cause routability problems later.
#WARNING (NRDB-2005) SPECIAL_NET 1'b0 has special wires but no definitions for instance pins or top level pins. This will cause routability problems later.
#WARNING (NRDB-976) The TRACK STEP 0.2800 for preferred direction tracks is smaller than the PITCH 0.2850 for LAYER metal4. This will cause routability problems for NanoRoute.
#WARNING (NRDB-976) The TRACK STEP 0.2800 for preferred direction tracks is smaller than the PITCH 0.2850 for LAYER metal6. This will cause routability problems for NanoRoute.
#WARNING (NRDB-976) The TRACK STEP 0.8400 for preferred direction tracks is smaller than the PITCH 0.8550 for LAYER metal8. This will cause routability problems for NanoRoute.
#WARNING (NRDB-976) The TRACK STEP 1.6800 for preferred direction tracks is smaller than the PITCH 1.7100 for LAYER metal10. This will cause routability problems for NanoRoute.
#NanoRoute Version 17.11-s080_1 NR170721-2155/17_11-UB
#Start routing data preparation on Wed Nov 26 23:36:05 2025
#
#WARNING (NRDB-2077) The below via enclosure for LAYER metal1 is not specified for width 0.0650.
#WARNING (NRDB-2078) The above via enclosure for LAYER metal2 is not specified for width 0.0700.
#WARNING (NRDB-2077) The below via enclosure for LAYER metal1 is not specified for width 0.0650.
#WARNING (NRDB-2078) The above via enclosure for LAYER metal2 is not specified for width 0.0700.
#WARNING (NRDB-2077) The below via enclosure for LAYER metal2 is not specified for width 0.0700.
#WARNING (NRDB-2078) The above via enclosure for LAYER metal3 is not specified for width 0.0700.
#WARNING (NRDB-2077) The below via enclosure for LAYER metal2 is not specified for width 0.0700.
#WARNING (NRDB-2078) The above via enclosure for LAYER metal3 is not specified for width 0.0700.
#WARNING (NRDB-2077) The below via enclosure for LAYER metal3 is not specified for width 0.0700.
#WARNING (NRDB-2078) The above via enclosure for LAYER metal4 is not specified for width 0.1400.
#WARNING (NRDB-2077) The below via enclosure for LAYER metal3 is not specified for width 0.0700.
#WARNING (NRDB-2078) The above via enclosure for LAYER metal4 is not specified for width 0.1400.
#WARNING (NRDB-2077) The below via enclosure for LAYER metal4 is not specified for width 0.1400.
#WARNING (NRDB-2078) The above via enclosure for LAYER metal5 is not specified for width 0.1400.
#WARNING (NRDB-2077) The below via enclosure for LAYER metal4 is not specified for width 0.1400.
#WARNING (NRDB-2078) The above via enclosure for LAYER metal5 is not specified for width 0.1400.
#WARNING (NRDB-2077) The below via enclosure for LAYER metal5 is not specified for width 0.1400.
#WARNING (NRDB-2078) The above via enclosure for LAYER metal6 is not specified for width 0.1400.
#WARNING (NRDB-2077) The below via enclosure for LAYER metal5 is not specified for width 0.1400.
#WARNING (NRDB-2078) The above via enclosure for LAYER metal6 is not specified for width 0.1400.
#WARNING (NRDB-2077) The below via enclosure for LAYER metal6 is not specified for width 0.1400.
#WARNING (NRDB-2078) The above via enclosure for LAYER metal7 is not specified for width 0.4000.
#WARNING (NRDB-2077) The below via enclosure for LAYER metal6 is not specified for width 0.1400.
#WARNING (NRDB-2078) The above via enclosure for LAYER metal7 is not specified for width 0.4000.
#WARNING (NRDB-2077) The below via enclosure for LAYER metal7 is not specified for width 0.4000.
#WARNING (NRDB-2078) The above via enclosure for LAYER metal8 is not specified for width 0.4000.
#WARNING (NRDB-2077) The below via enclosure for LAYER metal7 is not specified for width 0.4000.
#WARNING (NRDB-2078) The above via enclosure for LAYER metal8 is not specified for width 0.4000.
#WARNING (NRDB-2077) The below via enclosure for LAYER metal8 is not specified for width 0.4000.
#WARNING (NRDB-2078) The above via enclosure for LAYER metal9 is not specified for width 0.8000.
#WARNING (NRDB-2077) The below via enclosure for LAYER metal8 is not specified for width 0.4000.
#WARNING (NRDB-2078) The above via enclosure for LAYER metal9 is not specified for width 0.8000.
#WARNING (NRDB-2077) The below via enclosure for LAYER metal9 is not specified for width 0.8000.
#WARNING (NRDB-2078) The above via enclosure for LAYER metal10 is not specified for width 0.8000.
#WARNING (NRDB-2077) The below via enclosure for LAYER metal9 is not specified for width 0.8000.
#WARNING (NRDB-2078) The above via enclosure for LAYER metal10 is not specified for width 0.8000.
# metal1       H   Track-Pitch = 0.1900    Line-2-Via Pitch = 0.1300
# metal2       V   Track-Pitch = 0.1900    Line-2-Via Pitch = 0.1450
# metal3       H   Track-Pitch = 0.1900    Line-2-Via Pitch = 0.1400
# metal4       V   Track-Pitch = 0.2800    Line-2-Via Pitch = 0.2800
# metal5       H   Track-Pitch = 0.2850    Line-2-Via Pitch = 0.2800
# metal6       V   Track-Pitch = 0.2800    Line-2-Via Pitch = 0.2800
# metal7       H   Track-Pitch = 0.9500    Line-2-Via Pitch = 0.8000
# metal8       V   Track-Pitch = 0.8400    Line-2-Via Pitch = 0.8000
# metal9       H   Track-Pitch = 1.7100    Line-2-Via Pitch = 1.6000
# metal10      V   Track-Pitch = 1.6800    Line-2-Via Pitch = 1.6000
#Regenerating Ggrids automatically.
#Auto generating G-grids with size=15 tracks, using layer metal3's pitch = 0.1900.
#Using automatically generated G-grids.
#Done routing data preparation.
#cpu time = 00:00:00, elapsed time = 00:00:00, memory = 811.42 (MB), peak = 844.43 (MB)
#Merging special wires...
#
#Finished routing data preparation on Wed Nov 26 23:36:05 2025
#
#Cpu time = 00:00:00
#Elapsed time = 00:00:00
#Increased memory = 7.83 (MB)
#Total memory = 811.61 (MB)
#Peak memory = 844.43 (MB)
#
#
#Start global routing on Wed Nov 26 23:36:05 2025
#
#Number of eco nets is 0
#
#Start global routing data preparation on Wed Nov 26 23:36:05 2025
#
#Start routing resource analysis on Wed Nov 26 23:36:05 2025
#
#Routing resource analysis is done on Wed Nov 26 23:36:05 2025
#
#  Resource Analysis:
#
#               Routing  #Avail      #Track     #Total     %Gcell
#  Layer      Direction   Track     Blocked      Gcell    Blocked
#  --------------------------------------------------------------
#  metal1         H         927           0        3968     0.00%
#  metal2         V         955           8        3968     0.00%
#  metal3         H         927           0        3968     0.00%
#  metal4         V         641           0        3968     0.00%
#  metal5         H         617           0        3968     0.00%
#  metal6         V         641           0        3968     0.00%
#  metal7         H         185           0        3968     0.00%
#  metal8         V         217           0        3968     0.00%
#  metal9         H         102           0        3968     0.03%
#  metal10        V         108           0        3968     0.00%
#  --------------------------------------------------------------
#  Total                   5320       0.08%       39680     0.00%
#
#
#
#
#Global routing data preparation is done on Wed Nov 26 23:36:05 2025
#
#cpu time = 00:00:00, elapsed time = 00:00:00, memory = 812.49 (MB), peak = 844.43 (MB)
#
#cpu time = 00:00:00, elapsed time = 00:00:00, memory = 812.89 (MB), peak = 844.43 (MB)
#
#start global routing iteration 1...
#cpu time = 00:00:00, elapsed time = 00:00:00, memory = 824.29 (MB), peak = 844.43 (MB)
#
#start global routing iteration 2...
#cpu time = 00:00:00, elapsed time = 00:00:00, memory = 826.09 (MB), peak = 844.43 (MB)
#
#
#Total number of trivial nets (e.g. < 2 pins) = 48 (skipped).
#Total number of routable nets = 1923.
#Total number of nets in the design = 1971.
#
#1923 routable nets have only global wires.
#
#Routed nets constraints summary:
#-----------------------------
#        Rules   Unconstrained  
#-----------------------------
#      Default            1923  
#-----------------------------
#        Total            1923  
#-----------------------------
#
#Routing constraints summary of the whole design:
#-----------------------------
#        Rules   Unconstrained  
#-----------------------------
#      Default            1923  
#-----------------------------
#        Total            1923  
#-----------------------------
#
#
#  Congestion Analysis: (blocked Gcells are excluded)
#
#                 OverCon          
#                  #Gcell    %Gcell
#     Layer           (1)   OverCon
#  --------------------------------
#  metal1        0(0.00%)   (0.00%)
#  metal2        0(0.00%)   (0.00%)
#  metal3        0(0.00%)   (0.00%)
#  metal4        0(0.00%)   (0.00%)
#  metal5        0(0.00%)   (0.00%)
#  metal6        0(0.00%)   (0.00%)
#  metal7        0(0.00%)   (0.00%)
#  metal8        0(0.00%)   (0.00%)
#  metal9        0(0.00%)   (0.00%)
#  metal10       0(0.00%)   (0.00%)
#  --------------------------------
#     Total      0(0.00%)   (0.00%)
#
#  The worst congested Gcell overcon (routing demand over resource in number of tracks) = 1
#  Overflow after GR: 0.00% H + 0.00% V
#
Global router needs be called before using this command...
#Complete Global Routing.
#Total wire length = 44648 um.
#Total half perimeter of net bounding box = 40761 um.
#Total wire length on LAYER metal1 = 4215 um.
#Total wire length on LAYER metal2 = 21838 um.
#Total wire length on LAYER metal3 = 18226 um.
#Total wire length on LAYER metal4 = 210 um.
#Total wire length on LAYER metal5 = 156 um.
#Total wire length on LAYER metal6 = 3 um.
#Total wire length on LAYER metal7 = 0 um.
#Total wire length on LAYER metal8 = 0 um.
#Total wire length on LAYER metal9 = 0 um.
#Total wire length on LAYER metal10 = 0 um.
#Total number of vias = 11006
#Up-Via Summary (total 11006):
#           
#-----------------------
# metal1           6966
# metal2           3940
# metal3             57
# metal4             30
# metal5              7
# metal6              4
# metal7              1
# metal8              1
#-----------------------
#                 11006 
#
#Max overcon = 0 track.
#Total overcon = 0.00%.
#Worst layer Gcell overcon rate = 0.00%.
#
#Global routing statistics:
#Cpu time = 00:00:00
#Elapsed time = 00:00:00
#Increased memory = 14.86 (MB)
#Total memory = 826.48 (MB)
#Peak memory = 844.43 (MB)
#
#Finished global routing on Wed Nov 26 23:36:06 2025
#
#
#cpu time = 00:00:00, elapsed time = 00:00:00, memory = 819.00 (MB), peak = 844.43 (MB)
#Start Track Assignment.
#Done with 3347 horizontal wires in 1 hboxes and 2769 vertical wires in 1 hboxes.
#Done with 749 horizontal wires in 1 hboxes and 480 vertical wires in 1 hboxes.
#Done with 1 horizontal wires in 1 hboxes and 1 vertical wires in 1 hboxes.
#
#Track assignment summary:
# layer   (wire length)   (overlap)     (long ovlp)	(with obs/pg/clk)  
#------------------------------------------------------------------------
# metal1      4172.30 	  0.01%  	  0.00% 	  0.00%
# metal2     21652.55 	  0.02%  	  0.00% 	  0.01%
# metal3     18009.58 	  0.08%  	  0.00% 	  0.00%
# metal4       203.42 	  0.00%  	  0.00% 	  0.00%
# metal5       163.71 	  0.00%  	  0.00% 	  0.00%
# metal6         2.42 	  0.00%  	  0.00% 	  0.00%
# metal7         0.00 	  0.00%  	  0.00% 	  0.00%
# metal8         0.00 	  0.00%  	  0.00% 	  0.00%
# metal9         0.00 	  0.00%  	  0.00% 	  0.00%
# metal10        0.00 	  0.00%  	  0.00% 	  0.00%
#------------------------------------------------------------------------
# All       44203.97  	  0.04% 	  0.00% 	  0.00%
#Complete Track Assignment.
#Total wire length = 46831 um.
#Total half perimeter of net bounding box = 40761 um.
#Total wire length on LAYER metal1 = 5953 um.
#Total wire length on LAYER metal2 = 21636 um.
#Total wire length on LAYER metal3 = 18868 um.
#Total wire length on LAYER metal4 = 203 um.
#Total wire length on LAYER metal5 = 168 um.
#Total wire length on LAYER metal6 = 2 um.
#Total wire length on LAYER metal7 = 2 um.
#Total wire length on LAYER metal8 = 0 um.
#Total wire length on LAYER metal9 = 1 um.
#Total wire length on LAYER metal10 = 0 um.
#Total number of vias = 11006
#Up-Via Summary (total 11006):
#           
#-----------------------
# metal1           6966
# metal2           3940
# metal3             57
# metal4             30
# metal5              7
# metal6              4
# metal7              1
# metal8              1
#-----------------------
#                 11006 
#
#cpu time = 00:00:00, elapsed time = 00:00:00, memory = 821.03 (MB), peak = 844.43 (MB)
#
#Routing data preparation, pin analysis, global routing and track assignment statistics:
#Cpu time = 00:00:01
#Elapsed time = 00:00:01
#Increased memory = 17.30 (MB)
#Total memory = 821.09 (MB)
#Peak memory = 844.43 (MB)
#
#Start Detail Routing..
#start initial detail routing ...
#   number of violations = 363
#
#    By Layer and Type :
#	         MetSpc    Short     Loop   Totals
#	metal1        0      353        1      354
#	metal2        8        1        0        9
#	Totals        8      354        1      363
#cpu time = 00:00:09, elapsed time = 00:00:09, memory = 873.90 (MB), peak = 873.90 (MB)
#start 1st optimization iteration ...
#   number of violations = 6
#
#    By Layer and Type :
#	         MetSpc    Short   Totals
#	metal1        0        0        0
#	metal2        4        1        5
#	metal3        0        1        1
#	Totals        4        2        6
#cpu time = 00:00:02, elapsed time = 00:00:02, memory = 848.20 (MB), peak = 873.90 (MB)
#start 2nd optimization iteration ...
#   number of violations = 2
#
#    By Layer and Type :
#	         MetSpc    Short   Totals
#	metal1        0        0        0
#	metal2        1        1        2
#	Totals        1        1        2
#cpu time = 00:00:00, elapsed time = 00:00:00, memory = 848.20 (MB), peak = 873.90 (MB)
#start 3rd optimization iteration ...
#   number of violations = 1
#
#    By Layer and Type :
#	         MetSpc   Totals
#	metal1        0        0
#	metal2        1        1
#	Totals        1        1
#cpu time = 00:00:00, elapsed time = 00:00:00, memory = 848.20 (MB), peak = 873.90 (MB)
#start 4th optimization iteration ...
#   number of violations = 1
#
#    By Layer and Type :
#	         MetSpc   Totals
#	metal1        0        0
#	metal2        1        1
#	Totals        1        1
#cpu time = 00:00:00, elapsed time = 00:00:00, memory = 848.20 (MB), peak = 873.90 (MB)
#start 5th optimization iteration ...
#   number of violations = 0
#cpu time = 00:00:00, elapsed time = 00:00:00, memory = 848.20 (MB), peak = 873.90 (MB)
#Complete Detail Routing.
#Total wire length = 47457 um.
#Total half perimeter of net bounding box = 40761 um.
#Total wire length on LAYER metal1 = 4386 um.
#Total wire length on LAYER metal2 = 23629 um.
#Total wire length on LAYER metal3 = 18684 um.
#Total wire length on LAYER metal4 = 396 um.
#Total wire length on LAYER metal5 = 307 um.
#Total wire length on LAYER metal6 = 30 um.
#Total wire length on LAYER metal7 = 23 um.
#Total wire length on LAYER metal8 = 1 um.
#Total wire length on LAYER metal9 = 1 um.
#Total wire length on LAYER metal10 = 0 um.
#Total number of vias = 12463
#Up-Via Summary (total 12463):
#           
#-----------------------
# metal1           6765
# metal2           5525
# metal3            131
# metal4             30
# metal5              6
# metal6              4
# metal7              1
# metal8              1
#-----------------------
#                 12463 
#
#Total number of DRC violations = 0
#Cpu time = 00:00:11
#Elapsed time = 00:00:11
#Increased memory = 0.73 (MB)
#Total memory = 821.81 (MB)
#Peak memory = 873.90 (MB)
#
#Start Post Route wire spreading..
#
#Start DRC checking..
#   number of violations = 0
#cpu time = 00:00:01, elapsed time = 00:00:01, memory = 864.46 (MB), peak = 873.90 (MB)
#CELL_VIEW core,init has no DRC violation.
#Total number of DRC violations = 0
#
#Start data preparation for wire spreading...
#
#Data preparation is done on Wed Nov 26 23:36:18 2025
#
#
#Start Post Route Wire Spread.
#Done with 1716 horizontal wires in 1 hboxes and 1166 vertical wires in 2 hboxes.
#Complete Post Route Wire Spread.
#
#Total wire length = 48725 um.
#Total half perimeter of net bounding box = 40761 um.
#Total wire length on LAYER metal1 = 4464 um.
#Total wire length on LAYER metal2 = 24111 um.
#Total wire length on LAYER metal3 = 19391 um.
#Total wire length on LAYER metal4 = 396 um.
#Total wire length on LAYER metal5 = 309 um.
#Total wire length on LAYER metal6 = 30 um.
#Total wire length on LAYER metal7 = 23 um.
#Total wire length on LAYER metal8 = 1 um.
#Total wire length on LAYER metal9 = 1 um.
#Total wire length on LAYER metal10 = 0 um.
#Total number of vias = 12463
#Up-Via Summary (total 12463):
#           
#-----------------------
# metal1           6765
# metal2           5525
# metal3            131
# metal4             30
# metal5              6
# metal6              4
# metal7              1
# metal8              1
#-----------------------
#                 12463 
#
#
#Start DRC checking..
#   number of violations = 0
#cpu time = 00:00:01, elapsed time = 00:00:01, memory = 864.62 (MB), peak = 873.90 (MB)
#CELL_VIEW core,init has no DRC violation.
#Total number of DRC violations = 0
#   number of violations = 0
#cpu time = 00:00:01, elapsed time = 00:00:01, memory = 824.93 (MB), peak = 873.90 (MB)
#CELL_VIEW core,init has no DRC violation.
#Total number of DRC violations = 0
#Post Route wire spread is done.
#Total wire length = 48725 um.
#Total half perimeter of net bounding box = 40761 um.
#Total wire length on LAYER metal1 = 4464 um.
#Total wire length on LAYER metal2 = 24111 um.
#Total wire length on LAYER metal3 = 19391 um.
#Total wire length on LAYER metal4 = 396 um.
#Total wire length on LAYER metal5 = 309 um.
#Total wire length on LAYER metal6 = 30 um.
#Total wire length on LAYER metal7 = 23 um.
#Total wire length on LAYER metal8 = 1 um.
#Total wire length on LAYER metal9 = 1 um.
#Total wire length on LAYER metal10 = 0 um.
#Total number of vias = 12463
#Up-Via Summary (total 12463):
#           
#-----------------------
# metal1           6765
# metal2           5525
# metal3            131
# metal4             30
# metal5              6
# metal6              4
# metal7              1
# metal8              1
#-----------------------
#                 12463 
#
#detailRoute Statistics:
#Cpu time = 00:00:13
#Elapsed time = 00:00:13
#Increased memory = 1.72 (MB)
#Total memory = 822.80 (MB)
#Peak memory = 873.90 (MB)
#
#globalDetailRoute statistics:
#Cpu time = 00:00:14
#Elapsed time = 00:00:14
#Increased memory = 31.41 (MB)
#Total memory = 832.60 (MB)
#Peak memory = 873.90 (MB)
#Number of warnings = 42
#Total number of warnings = 43
#Number of fails = 0
#Total number of fails = 0
#Complete globalDetailRoute on Wed Nov 26 23:36:19 2025
#
#routeDesign: cpu time = 00:00:14, elapsed time = 00:00:14, memory = 832.75 (MB), peak = 873.90 (MB)

*** Summary of all messages that are not suppressed in this session:
Severity  ID               Count  Summary                                  
WARNING   IMPCK-8086           1  The command %s is obsolete and will be r...
*** Message Summary: 1 warning(s), 0 error(s)

<CMD> report_area
<CMD> fit
<CMD> fit
<CMD> zoomIn
<CMD> zoomIn
<CMD> zoomIn
<CMD> zoomOut
<CMD> zoomIn
<CMD> zoomOut
<CMD> zoomOut
<CMD> zoomOut
<CMD> fit
<CMD> verifyGeometry
 *** Starting Verify Geometry (MEM: 942.4) ***

**WARN: (IMPVFG-257):	verifyGeometry command is replaced by verify_drc command. It still works in this release but will be removed in future release. Please update your script to use the new command.
  VERIFY GEOMETRY ...... Starting Verification
  VERIFY GEOMETRY ...... Initializing
  VERIFY GEOMETRY ...... Deleting Existing Violations
  VERIFY GEOMETRY ...... Creating Sub-Areas
                  ...... bin size: 2080
VG: elapsed time: 0.00
Begin Summary ...
  Cells       : 0
  SameNet     : 0
  Wiring      : 0
  Antenna     : 0
  Short       : 0
  Overlap     : 0
End Summary

  Verification Complete : 0 Viols.  0 Wrngs.

**********End: VERIFY GEOMETRY**********
 *** verify geometry (CPU: 0:00:00.4  MEM: 128.9M)

<CMD> verifyConnectivity -type all -noAntenna -noWeakConnect -noSoftPGConnect -error 1000 -warning 50
VERIFY_CONNECTIVITY use new engine.

******** Start: VERIFY CONNECTIVITY ********
Start Time: Wed Nov 26 23:40:02 2025

Design Name: core
Database Units: 2000
Design Boundary: (0.0000, 0.0000) (182.9700, 176.1300)
Error Limit = 1000; Warning Limit = 50
Check all nets

Begin Summary 
  Found no problems or warnings.
End Summary

End Time: Wed Nov 26 23:40:02 2025
Time Elapsed: 0:00:00.0

******** End: VERIFY CONNECTIVITY ********
  Verification Complete : 0 Viols.  0 Wrngs.
  (CPU Time: 0:00:00.1  MEM: 0.000M)

<CMD> timeDesign -postRoute -pathReports -drvReports -expandedViews -prefix postRoute
**ERROR: (IMPOPT-6029):	Timing Library is not loaded yet
<CMD> report_timing -max_paths 1
#################################################################################
# Design Stage: PostRoute
# Design Name: core
# Design Mode: 90nm
# Analysis Mode: Non-MMMC Non-OCV 
# Parasitics Mode: No SPEF/RCDB
# Signoff Settings: SI Off 
#################################################################################
Extraction called for design 'core' of instances=1795 and nets=1971 using extraction engine 'preRoute' .
**WARN: (IMPEXT-3530):	The process node is not set. Use the command setDesignMode -process <process node> prior to extraction for maximum accuracy and optimal automatic threshold setting.
Type 'man IMPEXT-3530' for more detail.
PreRoute RC Extraction called for design core.
**WARN: (IMPEXT-6197):	The Cap table file is not specified. This will result in lower parasitic accuracy when using preRoute extraction or postRoute extraction with effort level 'low'. It is recommended to generate the Cap table file using the 'generateCapTbl' command and specify it before extraction using 'create_rc_corner/update_rc_corner -cap_table'.
Type 'man IMPEXT-6197' for more detail.
RCMode: PreRoute
Capacitance Scaling Factor   : 1.00000
Resistance Scaling Factor    : 1.00000
Clock Cap Scaling Factor    : 1.00000
Clock Res Scaling Factor     : 1.00000
Shrink Factor                : 1.00000
PreRoute extraction is honoring NDR/Shielding/ExtraSpace for clock nets.
Updating RC grid for preRoute extraction ...
PreRoute RC Extraction DONE (CPU Time: 0:00:00.0  Real Time: 0:00:00.0  MEM: 1073.984M)
Calculate delays in BcWc mode...
**ERROR: (IMPDC-634):	Failed to build the timing graph since timing library files have not yet been loaded. To resolve this, check that timing library files have been correctly specified in the loaded design database.
Type 'man IMPDC-634' for more detail.
Start delay calculation (fullDC) (1 T). (MEM=1073.98)
AAE DB initialization (MEM=1090.12 CPU=0:00:00.1 REAL=0:00:01.0) 
**WARN: (IMPEXT-2882):	Unable to find the resistance for via 'M3_M2_via' in Cap table or LEF or OA files. The default value of 4.0 ohms is being assigned. To avoid this, check the Cap table and LEF and OA files, provide the resistance and read the files again.
**WARN: (IMPEXT-2883):	The resistance extracted for a wire belonging to net clk is 0 ohms. Therefore, a small value of 0.1 ohms is assigned to it.
**WARN: (IMPEXT-2882):	Unable to find the resistance for via 'M2_M1_viaC' in Cap table or LEF or OA files. The default value of 4.0 ohms is being assigned. To avoid this, check the Cap table and LEF and OA files, provide the resistance and read the files again.
**WARN: (IMPEXT-2883):	The resistance extracted for a wire belonging to net clk is 0 ohms. Therefore, a small value of 0.1 ohms is assigned to it.
**WARN: (IMPEXT-2882):	Unable to find the resistance for via 'M4_M3_via' in Cap table or LEF or OA files. The default value of 4.0 ohms is being assigned. To avoid this, check the Cap table and LEF and OA files, provide the resistance and read the files again.
**WARN: (IMPEXT-2883):	The resistance extracted for a wire belonging to net rst is 0 ohms. Therefore, a small value of 0.1 ohms is assigned to it.
**WARN: (IMPEXT-2883):	The resistance extracted for a wire belonging to net rst is 0 ohms. Therefore, a small value of 0.1 ohms is assigned to it.
**WARN: (IMPEXT-2883):	The resistance extracted for a wire belonging to net rst is 0 ohms. Therefore, a small value of 0.1 ohms is assigned to it.
**WARN: (IMPEXT-2882):	Unable to find the resistance for via 'M6_M5_via' in Cap table or LEF or OA files. The default value of 4.0 ohms is being assigned. To avoid this, check the Cap table and LEF and OA files, provide the resistance and read the files again.
**WARN: (IMPEXT-2882):	Unable to find the resistance for via 'M5_M4_via' in Cap table or LEF or OA files. The default value of 4.0 ohms is being assigned. To avoid this, check the Cap table and LEF and OA files, provide the resistance and read the files again.
**WARN: (IMPEXT-2883):	The resistance extracted for a wire belonging to net rst is 0 ohms. Therefore, a small value of 0.1 ohms is assigned to it.
**WARN: (IMPEXT-2883):	The resistance extracted for a wire belonging to net rst is 0 ohms. Therefore, a small value of 0.1 ohms is assigned to it.
**WARN: (IMPEXT-2883):	The resistance extracted for a wire belonging to net i_rd_data[30] is 0 ohms. Therefore, a small value of 0.1 ohms is assigned to it.
**WARN: (IMPEXT-2883):	The resistance extracted for a wire belonging to net i_rd_data[30] is 0 ohms. Therefore, a small value of 0.1 ohms is assigned to it.
**WARN: (IMPEXT-2883):	The resistance extracted for a wire belonging to net i_rd_data[27] is 0 ohms. Therefore, a small value of 0.1 ohms is assigned to it.
**WARN: (IMPEXT-2883):	The resistance extracted for a wire belonging to net i_rd_data[27] is 0 ohms. Therefore, a small value of 0.1 ohms is assigned to it.
**WARN: (IMPEXT-2883):	The resistance extracted for a wire belonging to net i_rd_data[26] is 0 ohms. Therefore, a small value of 0.1 ohms is assigned to it.
**WARN: (IMPEXT-2883):	The resistance extracted for a wire belonging to net i_rd_data[25] is 0 ohms. Therefore, a small value of 0.1 ohms is assigned to it.
**WARN: (IMPEXT-2883):	The resistance extracted for a wire belonging to net i_rd_data[21] is 0 ohms. Therefore, a small value of 0.1 ohms is assigned to it.
**WARN: (IMPEXT-2883):	The resistance extracted for a wire belonging to net i_rd_data[14] is 0 ohms. Therefore, a small value of 0.1 ohms is assigned to it.
**WARN: (IMPEXT-2883):	The resistance extracted for a wire belonging to net i_rd_data[14] is 0 ohms. Therefore, a small value of 0.1 ohms is assigned to it.
**WARN: (IMPEXT-2883):	The resistance extracted for a wire belonging to net i_rd_data[14] is 0 ohms. Therefore, a small value of 0.1 ohms is assigned to it.
**WARN: (IMPEXT-2883):	The resistance extracted for a wire belonging to net i_rd_data[14] is 0 ohms. Therefore, a small value of 0.1 ohms is assigned to it.
**WARN: (IMPEXT-2883):	The resistance extracted for a wire belonging to net i_rd_data[14] is 0 ohms. Therefore, a small value of 0.1 ohms is assigned to it.
**WARN: (IMPEXT-2883):	The resistance extracted for a wire belonging to net i_rd_data[14] is 0 ohms. Therefore, a small value of 0.1 ohms is assigned to it.
**WARN: (EMS-27):	Message (IMPEXT-2883) has exceeded the current message display limit of 20.
To increase the message display limit, refer to the product command reference manual.
**WARN: (IMPEXT-2882):	Unable to find the resistance for via 'M7_M6_via' in Cap table or LEF or OA files. The default value of 4.0 ohms is being assigned. To avoid this, check the Cap table and LEF and OA files, provide the resistance and read the files again.
**WARN: (IMPEXT-2882):	Unable to find the resistance for via 'M8_M7_via' in Cap table or LEF or OA files. The default value of 4.0 ohms is being assigned. To avoid this, check the Cap table and LEF and OA files, provide the resistance and read the files again.
**WARN: (IMPEXT-2882):	Unable to find the resistance for via 'M9_M8_via' in Cap table or LEF or OA files. The default value of 4.0 ohms is being assigned. To avoid this, check the Cap table and LEF and OA files, provide the resistance and read the files again.
Total number of fetched objects 1923
End delay calculation. (MEM=1400.25 CPU=0:00:00.1 REAL=0:00:00.0)
End delay calculation (fullDC). (MEM=1400.25 CPU=0:00:00.4 REAL=0:00:01.0)
No constrained timing paths found.
Design may not be constrained or library is missing timing information.

<CMD> reset_parasitics
Performing RC Extraction ...
<CMD> extractRC
Extraction called for design 'core' of instances=1795 and nets=1971 using extraction engine 'preRoute' .
**WARN: (IMPEXT-3530):	The process node is not set. Use the command setDesignMode -process <process node> prior to extraction for maximum accuracy and optimal automatic threshold setting.
Type 'man IMPEXT-3530' for more detail.
PreRoute RC Extraction called for design core.
**WARN: (IMPEXT-6197):	The Cap table file is not specified. This will result in lower parasitic accuracy when using preRoute extraction or postRoute extraction with effort level 'low'. It is recommended to generate the Cap table file using the 'generateCapTbl' command and specify it before extraction using 'create_rc_corner/update_rc_corner -cap_table'.
Type 'man IMPEXT-6197' for more detail.
RCMode: PreRoute
Capacitance Scaling Factor   : 1.00000
Resistance Scaling Factor    : 1.00000
Clock Cap Scaling Factor    : 1.00000
Clock Res Scaling Factor     : 1.00000
Shrink Factor                : 1.00000
PreRoute extraction is honoring NDR/Shielding/ExtraSpace for clock nets.
Updating RC grid for preRoute extraction ...
PreRoute RC Extraction DONE (CPU Time: 0:00:00.0  Real Time: 0:00:00.0  MEM: 1400.250M)
<CMD> rcOut -spf core.spf
   RC-typical , Operating temperature 25 C
Dumping SPF file.....
**WARN: (IMPEXT-2883):	The resistance extracted for a wire belonging to net _0095_ is 0 ohms. Therefore, a small value of 0.1 ohms is assigned to it.
**WARN: (IMPEXT-2883):	The resistance extracted for a wire belonging to net _0102_ is 0 ohms. Therefore, a small value of 0.1 ohms is assigned to it.
**WARN: (IMPEXT-2883):	The resistance extracted for a wire belonging to net _0104_ is 0 ohms. Therefore, a small value of 0.1 ohms is assigned to it.
**WARN: (IMPEXT-2883):	The resistance extracted for a wire belonging to net _0112_ is 0 ohms. Therefore, a small value of 0.1 ohms is assigned to it.
**WARN: (IMPEXT-2883):	The resistance extracted for a wire belonging to net _0112_ is 0 ohms. Therefore, a small value of 0.1 ohms is assigned to it.
**WARN: (IMPEXT-2883):	The resistance extracted for a wire belonging to net _0117_ is 0 ohms. Therefore, a small value of 0.1 ohms is assigned to it.
**WARN: (IMPEXT-2883):	The resistance extracted for a wire belonging to net _0142_ is 0 ohms. Therefore, a small value of 0.1 ohms is assigned to it.
**WARN: (IMPEXT-2883):	The resistance extracted for a wire belonging to net _0162_ is 0 ohms. Therefore, a small value of 0.1 ohms is assigned to it.
**WARN: (IMPEXT-2883):	The resistance extracted for a wire belonging to net _0172_ is 0 ohms. Therefore, a small value of 0.1 ohms is assigned to it.
**WARN: (IMPEXT-2883):	The resistance extracted for a wire belonging to net _0279_ is 0 ohms. Therefore, a small value of 0.1 ohms is assigned to it.
**WARN: (IMPEXT-2883):	The resistance extracted for a wire belonging to net _0279_ is 0 ohms. Therefore, a small value of 0.1 ohms is assigned to it.
**WARN: (IMPEXT-2883):	The resistance extracted for a wire belonging to net _0283_ is 0 ohms. Therefore, a small value of 0.1 ohms is assigned to it.
**WARN: (IMPEXT-2883):	The resistance extracted for a wire belonging to net _0294_ is 0 ohms. Therefore, a small value of 0.1 ohms is assigned to it.
**WARN: (IMPEXT-2883):	The resistance extracted for a wire belonging to net _0294_ is 0 ohms. Therefore, a small value of 0.1 ohms is assigned to it.
**WARN: (IMPEXT-2883):	The resistance extracted for a wire belonging to net _0297_ is 0 ohms. Therefore, a small value of 0.1 ohms is assigned to it.
**WARN: (IMPEXT-2883):	The resistance extracted for a wire belonging to net _0311_ is 0 ohms. Therefore, a small value of 0.1 ohms is assigned to it.
**WARN: (IMPEXT-2883):	The resistance extracted for a wire belonging to net _0311_ is 0 ohms. Therefore, a small value of 0.1 ohms is assigned to it.
**WARN: (IMPEXT-2883):	The resistance extracted for a wire belonging to net _0315_ is 0 ohms. Therefore, a small value of 0.1 ohms is assigned to it.
**WARN: (IMPEXT-2883):	The resistance extracted for a wire belonging to net _0323_ is 0 ohms. Therefore, a small value of 0.1 ohms is assigned to it.
**WARN: (IMPEXT-2883):	The resistance extracted for a wire belonging to net _0361_ is 0 ohms. Therefore, a small value of 0.1 ohms is assigned to it.
**WARN: (EMS-27):	Message (IMPEXT-2883) has exceeded the current message display limit of 20.
To increase the message display limit, refer to the product command reference manual.
Created SPF File: core.spf
<CMD> saveDesign core
#% Begin save design ... (date=11/26 23:44:38, mem=990.1M)
% Begin Save netlist data ... (date=11/26 23:44:38, mem=992.0M)
Writing Binary DB to core.dat/core.v.bin in single-threaded mode...
% End Save netlist data ... (date=11/26 23:44:38, total cpu=0:00:00.0, real=0:00:00.0, peak res=992.1M, current mem=992.1M)
% Begin Save AAE data ... (date=11/26 23:44:38, mem=992.1M)
Saving AAE Data ...
% End Save AAE data ... (date=11/26 23:44:38, total cpu=0:00:00.0, real=0:00:00.0, peak res=992.1M, current mem=992.1M)
% Begin Save clock tree data ... (date=11/26 23:44:38, mem=992.1M)
% End Save clock tree data ... (date=11/26 23:44:38, total cpu=0:00:00.0, real=0:00:00.0, peak res=992.1M, current mem=992.1M)
Saving preference file core.dat/gui.pref.tcl ...
Saving mode setting ...
Saving global file ...
% Begin Save floorplan data ... (date=11/26 23:44:38, mem=992.6M)
Saving floorplan file ...
% End Save floorplan data ... (date=11/26 23:44:38, total cpu=0:00:00.0, real=0:00:01.0, peak res=992.6M, current mem=992.6M)
Saving Drc markers ...
... No Drc file written since there is no markers found.
% Begin Save placement data ... (date=11/26 23:44:39, mem=992.6M)
** Saving stdCellPlacement_binary (version# 1) ...
% End Save placement data ... (date=11/26 23:44:39, total cpu=0:00:00.0, real=0:00:00.0, peak res=992.6M, current mem=992.6M)
% Begin Save routing data ... (date=11/26 23:44:39, mem=992.6M)
Saving route file ...
*** Completed saveRoute (cpu=0:00:00.0 real=0:00:00.0 mem=1386.1M) ***
% End Save routing data ... (date=11/26 23:44:39, total cpu=0:00:00.0, real=0:00:00.0, peak res=992.8M, current mem=992.8M)
Saving property file core.dat/core.prop
*** Completed saveProperty (cpu=0:00:00.0 real=0:00:00.0 mem=1386.1M) ***
#Saving pin access info...
#
% Begin Save power constraints data ... (date=11/26 23:44:39, mem=995.2M)
% End Save power constraints data ... (date=11/26 23:44:39, total cpu=0:00:00.0, real=0:00:00.0, peak res=995.3M, current mem=995.3M)
**ERROR: (IMPOAX-142):	Could not open shared library libinnovusoax22.so : /usr/local/packages/cadence_2017/innovus171/tools.lnx86/lib/64bit/libstdc++.so.6: version `CXXABI_1.3.8' not found (required by /usr/local/packages/cadence_2022/INNOVUS211/oa_v22.60.087/lib/linux_rhel60_64/opt/liboaDesign.so)

**ERROR: (IMPOAX-142):	Could not open shared library libcdsSkillPcell.so : /usr/local/packages/cadence_2017/innovus171/tools.lnx86/lib/64bit/libcdsSkillPcell.so: undefined symbol: _ZTIN12OpenAccess_413oaFSComponentE

**ERROR: (IMPSYT-6245):	Error , while saving MS constraint file.
Generated self-contained design core.dat
#% End save design ... (date=11/26 23:44:39, total cpu=0:00:00.4, real=0:00:01.0, peak res=995.3M, current mem=968.2M)

*** Summary of all messages that are not suppressed in this session:
Severity  ID               Count  Summary                                  
ERROR     IMPSYT-6245          1  Error %s, while saving MS constraint fil...
ERROR     IMPOAX-142           2  %s                                       
*** Message Summary: 0 warning(s), 3 error(s)


*** Memory Usage v#1 (Current mem = 1457.266M, initial mem = 194.469M) ***
*** Message Summary: 1329 warning(s), 10 error(s)

--- Ending "Innovus" (totcpu=0:01:01, real=0:14:48, mem=1457.3M) ---
